Name,Handle,Bio,Followers,Engagement Rate (%),Status,Assigned To,Categories,Instagram URL,Post Count,Notes
"Max Mustermann | Fitness Coach","@maxfitness","Certified personal trainer specializing in strength training",45000,5.2,new_lead,"Sarah Martinez","fitness; male; dach","https://instagram.com/maxfitness",850,"Initial contact made via Instagram DM"
"Anna Schmidt | Lifestyle Blogger","@anna_lifestyle","Lifestyle and wellness blogger from Berlin",78000,4.8,contacted,"Tom Wilson","lifestyle; female; wellness; dach","https://instagram.com/anna_lifestyle",1240,"Very responsive, interested in collaboration"
"Lisa Weber | Yoga Instructor","@lisayoga","Certified yoga instructor and mindfulness coach",92000,6.1,negotiating,"Sarah Martinez","fitness; yoga; female; wellness","https://instagram.com/lisayoga",980,"Contract negotiations in progress"
"Michael Klein | Nutrition Expert","@mikenutrition","Certified nutritionist and health coach",34000,7.2,new_lead,"Tom Wilson","nutrition; male; health; dach","https://instagram.com/mikenutrition",560,"High engagement rate, potential partner"
"Sophie Wagner | Beauty & Lifestyle","@sophiebeauty","Beauty and lifestyle content creator from Munich",125000,4.1,partner,"Sarah Martinez","beauty; female; lifestyle; dach","https://instagram.com/sophiebeauty",1890,"Active partner since Q3 2024"
